{
  "schema_version": "experiment-v1",
  "fixture_only": true,
  "protocol": "smoke",
  "training_seeds": [
    42
  ],
  "requested_final_timesteps": 2048,
  "n_envs": 1,
  "split_manifest_sha256": "b972c71483d5316d82d7db2ea41f73589e418b66bf52813c7559e98c93ad4e45",
  "conditions": [
    {
      "condition_id": "ppo_multi_7",
      "algorithm": "ppo",
      "track_sampling": "uniform_train",
      "observation_version": "obs-rays7-v1",
      "reward_version": "reward-v1",
      "config_path": "examples/models/ppo_multi_7.json",
      "config_sha256": "e8f0f2514dfc6e5b17c0c7a60b17759d4706c429bf9cec5186280b9011eb7f20"
    },
    {
      "condition_id": "sac_multi_7",
      "algorithm": "sac",
      "track_sampling": "uniform_train",
      "observation_version": "obs-rays7-v1",
      "reward_version": "reward-v1",
      "config_path": "examples/models/sac_multi_7.json",
      "config_sha256": "f953a8ba19939124276bd807e7a5344025a2e79c1a6ca7a995df3445271c55ab"
    },
    {
      "condition_id": "ppo_multi_3",
      "algorithm": "ppo",
      "track_sampling": "uniform_train",
      "observation_version": "obs-rays3-v1",
      "reward_version": "reward-v1",
      "config_path": "examples/models/ppo_multi_3.json",
      "config_sha256": "298ca5b1ff11504dc70a97f1b7dce15b9d99ce558787e94ef3037d666fdfcace"
    },
    {
      "condition_id": "ppo_multi_15",
      "algorithm": "ppo",
      "track_sampling": "uniform_train",
      "observation_version": "obs-rays15-v1",
      "reward_version": "reward-v1",
      "config_path": "examples/models/ppo_multi_15.json",
      "config_sha256": "d02881ef6c8a45c4ae2e74ecc75742a9a5a9da4c86e7a4950f188f5faf36f462"
    },
    {
      "condition_id": "ppo_multi_no_steer_penalty",
      "algorithm": "ppo",
      "track_sampling": "uniform_train",
      "observation_version": "obs-rays7-v1",
      "reward_version": "reward-no-steer-v1",
      "config_path": "examples/models/ppo_multi_no_steer_penalty.json",
      "config_sha256": "fbbe792516600a8feb452d12e7aef7e31bcde7a2bc5d5b533cd8dac7f5c48f8a"
    },
    {
      "condition_id": "ppo_single_7",
      "algorithm": "ppo",
      "track_sampling": "fixed_demo",
      "observation_version": "obs-rays7-v1",
      "reward_version": "reward-v1",
      "config_path": "examples/models/ppo_single_7.json",
      "config_sha256": "e8f0f2514dfc6e5b17c0c7a60b17759d4706c429bf9cec5186280b9011eb7f20"
    }
  ],
  "evaluation": {
    "version": "evaluation-v1",
    "selection_version": "selection-v1",
    "eval_every_steps": 50000,
    "base_reset_seed": 9000,
    "episodes_per_track": 3,
    "deterministic": true,
    "evaluator_sha256": "e91090b09ca7c508702d1f1aa06fc31224beb59d29ea75b6cbf38e40805940db",
    "config_sha256": "7156cc441c28fdaa67c3a258574061efccc3e948a9697d5e88d29138b507276d"
  },
  "baselines": [
    {
      "agent_id": "random",
      "config": {
        "profile": "fixture"
      },
      "config_sha256": "555550e1dcd001cfbba0dbf011b2331895bd09b8ffd1afaf05b4e5c5473ac3f4"
    },
    {
      "agent_id": "scripted",
      "config": {
        "profile": "fixture"
      },
      "config_sha256": "555550e1dcd001cfbba0dbf011b2331895bd09b8ffd1afaf05b4e5c5473ac3f4"
    }
  ],
  "runs": [
    {
      "condition_id": "ppo_multi_7",
      "training_seed": 42,
      "run_path": "fixture-unexecuted/ppo_multi_7"
    },
    {
      "condition_id": "sac_multi_7",
      "training_seed": 42,
      "run_path": "fixture-unexecuted/sac_multi_7"
    },
    {
      "condition_id": "ppo_multi_3",
      "training_seed": 42,
      "run_path": "fixture-unexecuted/ppo_multi_3"
    },
    {
      "condition_id": "ppo_multi_15",
      "training_seed": 42,
      "run_path": "fixture-unexecuted/ppo_multi_15"
    },
    {
      "condition_id": "ppo_multi_no_steer_penalty",
      "training_seed": 42,
      "run_path": "fixture-unexecuted/ppo_multi_no_steer_penalty"
    },
    {
      "condition_id": "ppo_single_7",
      "training_seed": 42,
      "run_path": "fixture-unexecuted/ppo_single_7"
    }
  ]
}
